{
  "schema_version": 1,
  "revision": "aaaaaaaaaaaaaaaaaaaaaaaaaaaaaaaaaaaaaaaa",
  "environment": {
    "toolchain": "go1.25.0",
    "os": "linux",
    "arch": "amd64",
    "runner": "fixture runner"
  },
  "expected_suites": [
    "example"
  ],
  "suites": [
    {
      "id": "example",
      "parser": {
        "name": "go",
        "version": "1"
      },
      "command": "go test -run=^$ -bench=. -benchmem -count=4",
      "files": [
        "base.txt"
      ]
    }
  ]
}
